{
  "draft_hash": "8c90799ee9cb26e950b12520501f036a62da1f390d310f6f1fbcdeff63697a6d",
  "feedback": [
    {
      "affected_sections": [
        "whetstone-ai-spec-convergence-orchestrator-0-08-strict-candidate-convergence-declaration",
        "whetstone-ai-spec-convergence-orchestrator-0-08-strict-candidate-phase-2-failure-handling",
        "whetstone-ai-spec-convergence-orchestrator-0-08-strict-candidate-artifact-schemas-minimum-required-fields"
      ],
      "authority_impact": null,
      "baseline_severity": "major",
      "claim": "`reviewer_final_status` is referenced in both convergence_declaration.md minimum content and convergence_failure_report.json fields but its type, allowed values, and semantics are never defined anywhere in the spec.",
      "determinism_impact": "major",
      "evidence": "The Convergence Declaration section lists `reviewer_final_status` as a required minimum field. The Phase 2 Failure Handling section lists `reviewer_final_status` as a required report field. No definition, type, enum, or description of this field appears anywhere in the spec.",
      "feedback_id": "fb_r1_convergence_strict_check_001",
      "in_scope": true,
      "invariant_violated": "Every primitive MUST be computable. No implied behavior.",
      "issue_fingerprint": "a3f2c1d8e5b7094f6a2e3c9d1b8f0e7a5c4d6b2f1e9a8c3d7f0b4e6a2c1d9f3e",
      "issue_id": "iss_a3f2c1d8e5b7094f",
      "issue_type": "precision_gap",
      "normalized_severity": "major",
      "oscillation_key": {
        "concern_type": "precision_gap",
        "direction": "add",
        "scope": "local",
        "section_id": "whetstone-ai-spec-convergence-orchestrator-0-08-strict-candidate-convergence-declaration"
      },
      "recommended_change": "Define `reviewer_final_status` with its type (string enum), allowed values (e.g., `accepted`, `rejected`, `not_run`), and the semantics for each value in the Artifact Schemas section or as a named definition at its first reference.",
      "rubric_impact": null,
      "severity_rationale": null
    },
    {
      "affected_sections": [
        "whetstone-ai-spec-convergence-orchestrator-0-08-strict-candidate-convergence-declaration",
        "whetstone-ai-spec-convergence-orchestrator-0-08-strict-candidate-review-profiles"
      ],
      "authority_impact": null,
      "baseline_severity": "major",
      "claim": "The mechanism translating `convergence_strict_check` reviewer output into `declaration_status: accepted | rejected` is not specified. The spec asserts the declaration is accepted only if convergence_strict_check verifies it, but neither the verification criteria nor the feedback-to-status translation is defined.",
      "determinism_impact": "major",
      "evidence": "Convergence Declaration section states: 'The declaration is accepted only if convergence_strict_check verifies the declaration content against the current draft, rubric hash, target matrix, and unresolved issue set.' No criterion (severity threshold, explicit field, or procedure) for what constitutes passing verification appears anywhere in the spec. It is unspecified whether this uses standard reviewer_feedback.json or a separate artifact.",
      "feedback_id": "fb_r1_convergence_strict_check_002",
      "in_scope": true,
      "invariant_violated": "No implied behavior. Every primitive MUST be computable.",
      "issue_fingerprint": "b7e4d2f1a9c5038e2b6d4f8a3c7e1b9f5d2a4c8e6b3f1d7a9c5e2b4f8d6a1c38",
      "issue_id": "iss_b7e4d2f1a9c5038e",
      "issue_type": "precision_gap",
      "normalized_severity": "major",
      "oscillation_key": {
        "concern_type": "precision_gap",
        "direction": "constrain",
        "scope": "structural",
        "section_id": "whetstone-ai-spec-convergence-orchestrator-0-08-strict-candidate-convergence-declaration"
      },
      "recommended_change": "Specify the exact acceptance criterion for declaration verification, e.g., 'the declaration is accepted if convergence_strict_check returns zero blocker and zero major issues where affected_sections includes the declaration.' Specify whether the verification produces a dedicated artifact or reuses reviewer_feedback.json.",
      "rubric_impact": null,
      "severity_rationale": null
    },
    {
      "affected_sections": [
        "whetstone-ai-spec-convergence-orchestrator-0-08-strict-candidate-round-scheduling-algorithm",
        "whetstone-ai-spec-convergence-orchestrator-0-08-strict-candidate-round-strategy-adaptive"
      ],
      "authority_impact": null,
      "baseline_severity": "major",
      "claim": "Phase 2 defines three profiles in sequence but does not specify what happens when all configured profiles are exhausted without achieving clean convergence and max_rounds has not been reached.",
      "determinism_impact": "major",
      "evidence": "Round Strategy defines `phase_2: [convergence_strict_check, adversarial, convergence_strict_check]`. Round Scheduling Algorithm states: 'Phase 2 completes only when clean convergence is achieved.' No behavior is defined for the case where all three configured profiles run, convergence is not achieved, and round budget remains. Does Phase 2 loop back to the first profile, halt, or select a fallback?",
      "feedback_id": "fb_r1_convergence_strict_check_003",
      "in_scope": true,
      "invariant_violated": "No implied behavior. No hidden state transitions.",
      "issue_fingerprint": "c5a8f3d1b2e9047a3c6d8f2b5a9e1c7d4f6b8a2e0c4d7f1b3a5e8c2d6f9b1a4c",
      "issue_id": "iss_c5a8f3d1b2e9047a",
      "issue_type": "completeness_gap",
      "normalized_severity": "major",
      "oscillation_key": {
        "concern_type": "completeness_gap",
        "direction": "add",
        "scope": "structural",
        "section_id": "whetstone-ai-spec-convergence-orchestrator-0-08-strict-candidate-round-scheduling-algorithm"
      },
      "recommended_change": "Add an explicit rule for Phase 2 profile exhaustion without convergence, e.g., 'if Phase 2 configured profiles are exhausted without convergence and max_rounds has not been reached, the orchestrator MUST loop back to the first Phase 2 profile' or 'MUST halt with TARGET_NOT_REACHED.' The intended behavior must be stated explicitly.",
      "rubric_impact": null,
      "severity_rationale": null
    },
    {
      "affected_sections": [
        "whetstone-ai-spec-convergence-orchestrator-0-08-strict-candidate-artifact-schemas-minimum-required-fields",
        "whetstone-ai-spec-convergence-orchestrator-0-08-strict-candidate-conflict-escalation"
      ],
      "authority_impact": null,
      "baseline_severity": "major",
      "claim": "`conflict_report.json` is listed as a primary output and produced on conflict escalation, but no minimum field schema is defined in the Artifact Schemas section.",
      "determinism_impact": null,
      "evidence": "Primary Outputs lists `/rounds/conflict_report.json`. Conflict Escalation states 'Escalation produces: /rounds/conflict_report.json' but enumerates no fields. Artifact Schemas section defines schemas for reviewer_feedback.json, editor_summary.json, unresolved_issues.json, and rubric_gaps.json but omits conflict_report.json entirely.",
      "feedback_id": "fb_r1_convergence_strict_check_004",
      "in_scope": true,
      "invariant_violated": "Terminal report schemas MUST include all fields listed in their failure-handling sections plus terminal_state, generated_at, round_number, and draft_hash.",
      "issue_fingerprint": "d2f6b8a4c1e0953b7d5f2a8c4e6b1d9f3a7c5e8b2d4f1c6a9e3b7d5f2a4c8e1d",
      "issue_id": "iss_d2f6b8a4c1e0953b",
      "issue_type": "completeness_gap",
      "normalized_severity": "major",
      "oscillation_key": {
        "concern_type": "completeness_gap",
        "direction": "add",
        "scope": "local",
        "section_id": "whetstone-ai-spec-convergence-orchestrator-0-08-strict-candidate-artifact-schemas-minimum-required-fields"
      },
      "recommended_change": "Add a `conflict_report.json` minimum field schema to the Artifact Schemas section. At minimum it should include: round_number, draft_hash, terminal_state (when applicable), generated_at, conflict_id, conflict_fingerprint, conflict_type, conflict_severity, participating_issue_fingerprints, conflict_claim, and affected_sections.",
      "rubric_impact": null,
      "severity_rationale": null
    },
    {
      "affected_sections": [
        "whetstone-ai-spec-convergence-orchestrator-0-08-strict-candidate-round-scheduling-algorithm",
        "whetstone-ai-spec-convergence-orchestrator-0-08-strict-candidate-convergence-declaration"
      ],
      "authority_impact": null,
      "baseline_severity": "major",
      "claim": "The spec does not specify whether convergence is evaluated after each Phase 2 profile completes or only after all configured profiles in a pass have run, permitting non-deterministic termination behavior.",
      "determinism_impact": "major",
      "evidence": "Round Scheduling Algorithm states: 'Phase 2 executes configured profiles in order' and 'Phase 2 completes only when clean convergence is achieved.' Phase 2 strategy lists three profiles. It is unspecified whether the orchestrator checks for convergence after each individual profile (potentially terminating after the first convergence_strict_check if accepted) or only after all three profiles have run in sequence.",
      "feedback_id": "fb_r1_convergence_strict_check_005",
      "in_scope": true,
      "invariant_violated": "Deterministic convergence with no ambiguity in execution.",
      "issue_fingerprint": "e9b3a7f5c2d8164c8e6b4a2f9c7d5e1b3f8a6c4e2b9d7f5a3c1e8b6d4f2a9c5e",
      "issue_id": "iss_e9b3a7f5c2d8164c",
      "issue_type": "determinism_violation",
      "normalized_severity": "major",
      "oscillation_key": {
        "concern_type": "determinism_violation",
        "direction": "constrain",
        "scope": "local",